{
  "as_of": "2025-06-02 00:00:00+03:00",
  "timeframe": "1D",
  "sleeves": [
    {
      "sleeve": "s3_event",
      "strategy": "dividend_runup",
      "gross": 2.0
    }
  ],
  "net_positions": [
    {
      "ticker": "SBER",
      "weight": 0.34,
      "side": "LONG",
      "sector": "MOEXFN",
      "sleeve_contributions": {
        "s3_event": 0.34
      }
    },
    {
      "ticker": "LKOH",
      "weight": 0.3,
      "side": "LONG",
      "sector": "MOEXOG",
      "sleeve_contributions": {
        "s3_event": 0.36
      }
    },
    {
      "ticker": "TATN",
      "weight": 0.3,
      "side": "LONG",
      "sector": "MOEXOG",
      "sleeve_contributions": {
        "s3_event": 0.3
      }
    }
  ],
  "hedge": {
    "mode": "sector",
    "legs": [
      {
        "instrument": "MOEXFN",
        "weight": -0.34
      },
      {
        "instrument": "MOEXOG",
        "weight": -0.6
      }
    ]
  },
  "risk_scalars": {
    "target_book_vol_annual": 0.12,
    "book_vol_estimate_annual": 0.081219,
    "vol_scalar": 1.477486,
    "exposure_scalar": 1.0,
    "regime_novel": false,
    "directional_gross": 0.94,
    "total_gross": 1.88
  },
  "limits": {
    "max_name_weight": 0.34,
    "max_sector_gross": 0.6,
    "max_gross": 1.0,
    "name_caps_ok": true,
    "sector_caps_ok": true,
    "gross_cap_ok": true,
    "binding": [
      "name_cap:LKOH",
      "name_cap:SBER",
      "name_cap:TATN",
      "sector_cap:MOEXOG",
      "vol_target"
    ]
  },
  "model_version": "risk_combiner_v0",
  "is_production": false
}
